{
  "$schema": "../scene.schema.json",
  "schemaVersion": 1,
  "id": "opening-week",
  "title": "Coach's Corner: draft and opening matchups",
  "assetManifest": "/coachs-corner/robots-v2/manifest.json",
  "timing": {
    "mode": "text",
    "wordUnit": "whitespace-token",
    "autoPunctuationPauses": false,
    "defaultDelivery": "normal",
    "defaultWpm": 180,
    "defaultRunHoldMs": 0,
    "defaultLineHoldMs": 180,
    "poseTransitionMs": 120,
    "mouthTransitionMs": 70,
    "mouthCycleMs": 190
  },
  "accessibility": {
    "reducedMotion": "disable-motion",
    "keepTypography": true
  },
  "characters": {
    "don": {
      "name": "Don",
      "seat": "left",
      "idlePose": "don-default",
      "talkPose": "don-talk"
    },
    "ron": {
      "name": "Ron",
      "seat": "right",
      "idlePose": "ron-default",
      "talkPose": "ron-talk"
    }
  },
  "deliveryStyles": {
    "normal": {
      "typography": {
        "fontScale": 1,
        "fontWeight": 500,
        "fontStyle": "normal"
      },
      "textMotion": {
        "effect": "none",
        "offsetPx": 0,
        "rotationDeg": 0,
        "hz": 0
      },
      "characterMotion": {
        "effect": "bob",
        "offsetPx": 0.9,
        "rotationDeg": 0.15,
        "hz": 6
      }
    },
    "yell": {
      "typography": {
        "fontScale": 1.32,
        "fontWeight": 800,
        "fontStyle": "normal"
      },
      "textMotion": {
        "effect": "shake",
        "offsetPx": 1.4,
        "rotationDeg": 0.2,
        "hz": 9
      },
      "characterMotion": {
        "effect": "shake",
        "offsetPx": 2.5,
        "rotationDeg": 0.55,
        "hz": 9
      }
    },
    "deadpan": {
      "typography": {
        "fontScale": 1,
        "fontWeight": 500,
        "fontStyle": "normal"
      },
      "textMotion": {
        "effect": "none",
        "offsetPx": 0,
        "rotationDeg": 0,
        "hz": 0
      },
      "characterMotion": {
        "effect": "none",
        "offsetPx": 0,
        "rotationDeg": 0,
        "hz": 0
      }
    },
    "firm": {
      "typography": {
        "fontScale": 1.08,
        "fontWeight": 700,
        "fontStyle": "normal"
      },
      "textMotion": {
        "effect": "none",
        "offsetPx": 0,
        "rotationDeg": 0,
        "hz": 0
      },
      "characterMotion": {
        "effect": "bob",
        "offsetPx": 0.5,
        "rotationDeg": 0.1,
        "hz": 5
      }
    },
    "mocking": {
      "typography": {
        "fontScale": 1,
        "fontWeight": 500,
        "fontStyle": "italic"
      },
      "textMotion": {
        "effect": "none",
        "offsetPx": 0,
        "rotationDeg": 0,
        "hz": 0
      },
      "characterMotion": {
        "effect": "bob",
        "offsetPx": 1.1,
        "rotationDeg": 0.25,
        "hz": 5
      }
    },
    "warm": {
      "typography": {
        "fontScale": 1,
        "fontWeight": 600,
        "fontStyle": "normal"
      },
      "textMotion": {
        "effect": "none",
        "offsetPx": 0,
        "rotationDeg": 0,
        "hz": 0
      },
      "characterMotion": {
        "effect": "bob",
        "offsetPx": 0.8,
        "rotationDeg": 0.15,
        "hz": 5
      }
    }
  },
  "initialState": {
    "poses": {
      "don": "don-point",
      "ron": "ron-default"
    },
    "props": {
      "monitorPower": "off"
    }
  },
  "events": [
    {
      "id": "direction-01",
      "type": "stage",
      "poses": {
        "don": "don-point",
        "ron": "ron-default"
      },
      "props": {
        "monitorPower": "off"
      },
      "transitionMs": 0,
      "durationMs": 450,
      "caption": "clear",
      "direction": "Don is already pointing at a monitor that isn’t on."
    },
    {
      "id": "line-001",
      "type": "say",
      "speaker": "ron",
      "delivery": "normal",
      "wpm": 172,
      "pose": "ron-talk",
      "listenerPoses": {
        "don": "don-point"
      },
      "afterPose": "ron-default",
      "ending": "interrupted",
      "interruptedBy": "don",
      "holdAfterMs": 0,
      "runs": [
        {
          "text": "The YOFHL draft was Saturday, and we’ve got the opening matchups—",
          "holdAfterMs": 0
        }
      ]
    },
    {
      "id": "line-002",
      "type": "say",
      "speaker": "don",
      "delivery": "normal",
      "wpm": 192,
      "pose": "don-point-talk",
      "listenerPoses": {
        "ron": "ron-default"
      },
      "afterPose": "don-point",
      "ending": "complete",
      "holdAfterMs": 180,
      "runs": [
        {
          "text": "Yeah.",
          "holdAfterMs": 140
        },
        {
          "text": " And put the thing up.",
          "holdAfterMs": 140
        },
        {
          "text": " The other thing.",
          "holdAfterMs": 140
        },
        {
          "text": " With the kid.",
          "holdAfterMs": 140
        },
        {
          "text": " No, that’s the standings.",
          "holdAfterMs": 140
        },
        {
          "text": " I don’t want the standings.",
          "holdAfterMs": 0
        }
      ]
    },
    {
      "id": "line-003",
      "type": "say",
      "speaker": "ron",
      "delivery": "deadpan",
      "wpm": 152,
      "pose": "ron-skeptical-talk",
      "listenerPoses": {
        "don": "don-point"
      },
      "afterPose": "ron-default",
      "ending": "complete",
      "holdAfterMs": 180,
      "runs": [
        {
          "text": "The draft.",
          "holdAfterMs": 0
        }
      ]
    },
    {
      "id": "line-004",
      "type": "say",
      "speaker": "don",
      "delivery": "normal",
      "wpm": 184,
      "pose": "don-talk",
      "listenerPoses": {
        "ron": "ron-default"
      },
      "afterPose": "don-default",
      "ending": "interrupted",
      "interruptedBy": "ron",
      "holdAfterMs": 0,
      "runs": [
        {
          "text": "THE DRAFT.",
          "delivery": "yell",
          "pose": "don-angry-talk",
          "wpm": 165,
          "holdAfterMs": 140
        },
        {
          "text": " That’s what I said.",
          "holdAfterMs": 140
        },
        {
          "text": " Now, McKenney goes first—",
          "holdAfterMs": 0
        }
      ]
    },
    {
      "id": "line-005",
      "type": "say",
      "speaker": "ron",
      "delivery": "deadpan",
      "wpm": 145,
      "pose": "ron-skeptical-talk",
      "listenerPoses": {
        "don": "don-default"
      },
      "afterPose": "ron-default",
      "ending": "complete",
      "holdAfterMs": 180,
      "runs": [
        {
          "text": "McKenna.",
          "holdAfterMs": 0
        }
      ]
    },
    {
      "id": "line-006",
      "type": "say",
      "speaker": "don",
      "delivery": "normal",
      "wpm": 184,
      "pose": "don-talk",
      "listenerPoses": {
        "ron": "ron-default"
      },
      "afterPose": "don-default",
      "ending": "complete",
      "holdAfterMs": 180,
      "runs": [
        {
          "text": "I KNOW THE KID.",
          "delivery": "yell",
          "pose": "don-angry-talk",
          "wpm": 177,
          "holdAfterMs": 140
        },
        {
          "text": " Terrific kid.",
          "delivery": "warm",
          "wpm": 164,
          "holdAfterMs": 140
        },
        {
          "text": " And then Boldy.",
          "holdAfterMs": 140
        },
        {
          "text": " Good player.",
          "holdAfterMs": 140
        },
        {
          "text": " Then this Stenborg fella goes third.",
          "holdAfterMs": 0
        }
      ]
    },
    {
      "id": "line-007",
      "type": "say",
      "speaker": "ron",
      "delivery": "deadpan",
      "wpm": 156,
      "pose": "ron-skeptical-talk",
      "listenerPoses": {
        "don": "don-default"
      },
      "afterPose": "ron-default",
      "ending": "complete",
      "holdAfterMs": 180,
      "runs": [
        {
          "text": "Ivar Stenberg.",
          "holdAfterMs": 0
        }
      ]
    },
    {
      "id": "line-008",
      "type": "say",
      "speaker": "don",
      "delivery": "normal",
      "wpm": 197,
      "pose": "don-talk",
      "listenerPoses": {
        "ron": "ron-default"
      },
      "afterPose": "don-default",
      "ending": "interrupted",
      "interruptedBy": "ron",
      "holdAfterMs": 0,
      "runs": [
        {
          "text": "Yeah.",
          "holdAfterMs": 140
        },
        {
          "text": " And you’ve got fellas sitting there, played in the league, can help you ",
          "holdAfterMs": 0
        },
        {
          "text": "NOW,",
          "delivery": "firm",
          "wpm": 140,
          "holdAfterMs": 0
        },
        {
          "text": " and Jeremy’s taking a kid because some guy on the computer says—",
          "holdAfterMs": 0
        }
      ]
    },
    {
      "id": "line-009",
      "type": "say",
      "speaker": "ron",
      "delivery": "deadpan",
      "wpm": 164,
      "pose": "ron-skeptical-talk",
      "listenerPoses": {
        "don": "don-default"
      },
      "afterPose": "ron-default",
      "ending": "complete",
      "holdAfterMs": 180,
      "runs": [
        {
          "text": "It’s a keeper league.",
          "holdAfterMs": 0
        }
      ]
    },
    {
      "id": "line-010",
      "type": "say",
      "speaker": "don",
      "delivery": "normal",
      "wpm": 184,
      "pose": "don-talk",
      "listenerPoses": {
        "ron": "ron-default"
      },
      "afterPose": "don-default",
      "ending": "self-cutoff",
      "holdAfterMs": 0,
      "runs": [
        {
          "text": "I KNOW IT’S A KEEPER LEAGUE, RON.",
          "delivery": "yell",
          "pose": "don-angry-talk",
          "wpm": 198,
          "holdAfterMs": 140
        },
        {
          "text": " You think I came in here and didn’t know that?",
          "delivery": "firm",
          "wpm": 198,
          "holdAfterMs": 170
        },
        {